Start Time;End Time;Sentence
00:00:02,347;00:00:07,712;С понедельника по пятницу пять совершенно разных людей ходят друг к другу в гости.
00:00:07,772;00:00:14,898;Каждый из них имеет одинаковые условия при покупке продуктов и только три часа на приготовление ужина из трех блюд.
00:00:14,958;00:00:19,081;Задача каждого продемонстрировать гостям все свои таланты.
00:00:19,141;00:00:23,325;Что подать к столу и как развлекать гостей решает сам хозяин дома.
00:00:23,365;00:00:31,571;Каждый вечер гости выставляют хозяину оценки и в пятницу мы узнаем имя победителя, который получит приз от программы «Званый ужин».
00:00:32,311;00:00:37,777;Победитель недели станет участником суперфинала, в котором встретятся лучшие из лучших.
00:00:37,837;00:00:45,184;Смотрите на канале РЕН-ТВ программу «Званый ужин», в которой каждый может доказать, что именно он непревзойдённый хозяин.
